{
  "$schema": "https://json-schema.org/draft/2020-12/schema",
  "type": "array",
  "items": {
    "type": "object",
    "required": ["id", "name", "description", "cardIds"],
    "additionalProperties": false,
    "properties": {
      "id": { "type": "string" }, "name": { "type": "string" }, "description": { "type": "string" },
      "cardIds": { "type": "array", "items": { "type": "string" } }
    }
  }
}
